{
  "schemaVersion": 1,
  "id": "plan-demo",
  "revision": 1,
  "scopeDigest": "synthetic-scope-1",
  "segments": [
    {
      "id": "clip-1",
      "episodeID": "episode-1",
      "mediaVersionID": "media-1",
      "transcriptRevisionID": "transcript-1",
      "evidenceIDs": [
        "ev-1-0"
      ],
      "coreRange": {
        "startMs": 10000,
        "endMs": 26000
      },
      "playbackRange": {
        "startMs": 5000,
        "endMs": 70000
      },
      "reason": "Aussage mit einschränkendem Kontext hören."
    },
    {
      "id": "clip-2",
      "episodeID": "episode-2",
      "mediaVersionID": "media-2",
      "transcriptRevisionID": "transcript-2",
      "evidenceIDs": [
        "ev-2-1"
      ],
      "coreRange": {
        "startMs": 30000,
        "endMs": 46000
      },
      "playbackRange": {
        "startMs": 25000,
        "endMs": 70000
      },
      "reason": "Vergleichende Perspektive mit Kontext."
    }
  ],
  "activeListeningBudgetMs": 120000,
  "playbackRate": 1.25,
  "transitionMs": 1000,
  "estimatedListeningMs": 89000,
  "planHash": "4bccd7a9ac366006096f1a9c06323adfee38337b066c0b6ba6a7033163934710"
}
